{
  "_metadata": {
    "description": "Sample TOR2 configuration for Azure Local fully-converged deployment pattern",
    "pattern": "fully_converged",
    "generated_by": "Azure Local Physical Network Config Tool",
    "version": "1.0"
  },
  "switch": {
    "vendor": "dellemc",
    "model": "s5248f-on",
    "hostname": "sample-tor2",
    "role": "TOR2",
    "firmware": "os10",
    "deployment_pattern": "fully_converged",
    "version": "0.0"
  },
  "vlans": [
    {
      "vlan_id": 2,
      "name": "UNUSED_VLAN",
      "purpose": "parking",
      "shutdown": true
    },
    {
      "vlan_id": 7,
      "name": "Mgmt_7",
      "purpose": "management",
      "interface": {
        "ip": "192.0.2.3",
        "cidr": 24,
        "mtu": 9216,
        "redundancy": {
          "type": "vrrp",
          "group": 7,
          "priority": 100,
          "virtual_ip": "192.0.2.1"
        }
      }
    },
    {
      "vlan_id": 201,
      "name": "Compute_201",
      "purpose": "compute",
      "interface": {
        "ip": "198.51.100.3",
        "cidr": 24,
        "mtu": 9216,
        "redundancy": {
          "type": "vrrp",
          "group": 201,
          "priority": 100,
          "virtual_ip": "198.51.100.1"
        }
      }
    },
    {
      "vlan_id": 99,
      "name": "Native_99"
    },
    {
      "vlan_id": 711,
      "name": "Storage1_711",
      "purpose": "storage_1"
    },
    {
      "vlan_id": 712,
      "name": "Storage2_712",
      "purpose": "storage_2"
    }
  ],
  "interfaces": [
    {
      "name": "Loopback0",
      "type": "L3",
      "intf_type": "loopback",
      "intf": "loopback0",
      "ipv4": "203.0.113.2/32"
    },
    {
      "name": "P2P_Border1",
      "type": "L3",
      "intf_type": "Ethernet",
      "intf": "1/1/47",
      "ipv4": "198.51.100.14/30"
    },
    {
      "name": "P2P_Border2",
      "type": "L3",
      "intf_type": "Ethernet",
      "intf": "1/1/48",
      "ipv4": "198.51.100.18/30"
    },
    {
      "name": "Host_Trunk",
      "type": "Trunk",
      "intf_type": "Ethernet",
      "start_intf": "1/1/1",
      "end_intf": "1/1/16",
      "native_vlan": "7",
      "tagged_vlans": "7,201,711,712",
      "qos": true,
      "service_policy": {
        "qos_input": "AZLOCAL_PFC",
        "qos_output": "AZLOCAL_ETS"
      }
    }
  ],
  "port_channels": [
    {
      "id": 101,
      "description": "MLAG_Peer_Link",
      "type": "Trunk",
      "native_vlan": "99",
      "tagged_vlans": "7,201",
      "vpc_peer_link": true,
      "members": [
        "1/1/49",
        "1/1/50",
        "1/1/51",
        "1/1/52"
      ]
    },
    {
      "id": 50,
      "description": "iBGP_Peer_Link",
      "type": "L3",
      "ipv4": "203.0.113.6/30",
      "members": [
        "1/1/39",
        "1/1/40"
      ]
    }
  ],
  "mlag": {
    "domain_id": 1,
    "peer_keepalive": {
      "source_ip": "192.0.2.3",
      "destination_ip": "192.0.2.2"
    }
  },
  "bgp": {
    "asn": 65001,
    "router_id": "203.0.113.2",
    "networks": [
      "192.0.2.0/24",
      "198.51.100.0/24"
    ],
    "neighbors": [
      {
        "ip": "198.51.100.13",
        "description": "TO_BORDER1",
        "remote_as": 65010,
        "af_ipv4_unicast": {}
      },
      {
        "ip": "198.51.100.17",
        "description": "TO_BORDER2",
        "remote_as": 65010,
        "af_ipv4_unicast": {}
      }
    ]
  },
  "prefix_lists": {}
}
