{
  "_metadata": {
    "description": "Sample TOR2 configuration for Azure Local switchless deployment pattern with static routing",
    "pattern": "switchless",
    "generated_by": "Azure Local Physical Network Config Tool",
    "version": "1.0"
  },
  "switch": {
    "vendor": "dellemc",
    "model": "s5248f-on",
    "hostname": "sample-tor2",
    "role": "TOR2",
    "firmware": "os10",
    "deployment_pattern": "switchless",
    "version": "0.0"
  },
  "vlans": [
    {
      "vlan_id": 2,
      "name": "UNUSED_VLAN",
      "purpose": "parking",
      "shutdown": true
    },
    {
      "vlan_id": 7,
      "name": "Mgmt_7",
      "purpose": "management",
      "interface": {
        "ip": "192.0.2.3",
        "cidr": 24,
        "mtu": 9216,
        "redundancy": {
          "type": "vrrp",
          "group": 7,
          "priority": 100,
          "virtual_ip": "192.0.2.1"
        }
      }
    },
    {
      "vlan_id": 201,
      "name": "Compute_201",
      "purpose": "compute",
      "interface": {
        "ip": "198.51.100.3",
        "cidr": 24,
        "mtu": 9216,
        "redundancy": {
          "type": "vrrp",
          "group": 201,
          "priority": 100,
          "virtual_ip": "198.51.100.1"
        }
      }
    },
    {
      "vlan_id": 99,
      "name": "Native_99"
    }
  ],
  "interfaces": [
    {
      "name": "Loopback0",
      "type": "L3",
      "intf_type": "loopback",
      "intf": "loopback0",
      "ipv4": "203.0.113.2/32"
    },
    {
      "name": "P2P_Border1",
      "type": "L3",
      "intf_type": "Ethernet",
      "intf": "1/1/47",
      "ipv4": "198.51.100.14/30"
    },
    {
      "name": "P2P_Border2",
      "type": "L3",
      "intf_type": "Ethernet",
      "intf": "1/1/48",
      "ipv4": "198.51.100.18/30"
    },
    {
      "name": "Host_Trunk",
      "type": "Trunk",
      "intf_type": "Ethernet",
      "start_intf": "1/1/1",
      "end_intf": "1/1/16",
      "native_vlan": "7",
      "tagged_vlans": "7,201"
    }
  ],
  "port_channels": [
    {
      "id": 101,
      "description": "MLAG_Peer_Link",
      "type": "Trunk",
      "native_vlan": "99",
      "tagged_vlans": "7,201",
      "vpc_peer_link": true,
      "members": [
        "1/1/49",
        "1/1/50",
        "1/1/51",
        "1/1/52"
      ]
    }
  ],
  "mlag": {
    "domain_id": 1,
    "peer_keepalive": {
      "source_ip": "192.0.2.3",
      "destination_ip": "192.0.2.2"
    }
  },
  "static_routes": [
    {
      "destination": "0.0.0.0/0",
      "next_hop": "198.51.100.13",
      "name": "Default_Gateway_Border1"
    },
    {
      "destination": "10.0.0.0/8",
      "next_hop": "198.51.100.17",
      "name": "Internal_Networks_Border2"
    },
    {
      "destination": "172.16.0.0/12",
      "next_hop": "198.51.100.13",
      "name": "Private_Networks_Border1"
    }
  ],
  "prefix_lists": {}
}
